Question,
List all the employees,
Retrieve the total salary expenditure for each department,
Find employees who have not completed any training programs,
List the performance reviews of employees with the highest ratings,
Retrieve employees and their departments along with their job titles,
Show the number of employees in each department,
Retrieve performance reviews highlighting specific strengths or weaknesses,
Find all training programs that are mandatory for specific roles,
Show the goals met for each employee during performance reviews.